{
  "$schema": "http://json-schema.org/draft-07/schema#",
  "title": "Nexa AI Completion Report",
  "type": "object",
  "required": ["task_id", "status", "worker_id", "summary", "changes", "files_changed", "tests", "git", "completed_at"],
  "properties": {
    "task_id": {
      "type": "string",
      "pattern": "^NEXA-\\d{4}$"
    },
    "status": {
      "type": "string",
      "enum": ["completed", "failed", "partial", "blocked", "interrupted"]
    },
    "worker_id": { "type": "string" },
    "worktree_path": { "type": "string" },
    "task_branch": { "type": "string" },
    "commit_sha": { "type": "string" },
    "worktree_status": {
      "type": "string",
      "enum": ["AVAILABLE", "ASSIGNED", "CREATING", "READY", "RUNNING", "TESTING", "COMPLETED", "RELEASED", "DIRTY", "ORPHANED", "INTERRUPTED", "BLOCKED"],
      "default": "COMPLETED"
    },
    "attempt": { "type": "integer", "default": 1 },
    "max_attempts": { "type": "integer", "default": 2 },
    "summary": {
      "type": "string",
      "description": "Human-readable summary of what was done"
    },
    "root_cause": {
      "type": "string",
      "description": "Root cause analysis for bug fix tasks"
    },
    "investigation_findings": {
      "type": "object",
      "properties": {
        "observed_behavior": { "type": "string" },
        "root_cause": { "type": "string" },
        "affected_files": { "type": "array", "items": { "type": "string" } },
        "evidence": { "type": "string" },
        "recommended_fix": { "type": "string" }
      }
    },
    "changes": {
      "type": "array",
      "items": { "type": "string" },
      "description": "List of changes made"
    },
    "files_changed": {
      "type": "array",
      "items": {
        "type": "object",
        "properties": {
          "path": { "type": "string" },
          "action": { "type": "string", "enum": ["created", "modified", "deleted"] }
        }
      }
    },
    "database_changes": {
      "type": "array",
      "items": { "type": "string" },
      "description": "Migrations or schema changes"
    },
    "tests": {
      "type": "object",
      "properties": {
        "typecheck": {
          "type": "object",
          "properties": {
            "status": { "type": "string", "enum": ["passed", "failed", "skipped"] },
            "duration_ms": { "type": "integer" }
          }
        },
        "lint": {
          "type": "object",
          "properties": {
            "status": { "type": "string", "enum": ["passed", "failed", "skipped"] },
            "errors": { "type": "integer" },
            "warnings": { "type": "integer" }
          }
        },
        "build": {
          "type": "object",
          "properties": {
            "status": { "type": "string", "enum": ["passed", "failed", "skipped"] },
            "duration_ms": { "type": "integer" }
          }
        },
        "unit_tests": {
          "type": "object",
          "properties": {
            "status": { "type": "string", "enum": ["passed", "failed", "skipped"] },
            "total": { "type": "integer" },
            "passed": { "type": "integer" },
            "failed": { "type": "integer" }
          }
        }
      }
    },
    "acceptance_criteria_status": {
      "type": "array",
      "items": {
        "type": "object",
        "properties": {
          "criterion": { "type": "string" },
          "satisfied": { "type": "boolean" },
          "evidence": { "type": "string" }
        }
      }
    },
    "verification": {
      "type": "array",
      "items": { "type": "string" },
      "description": "Manual verification steps performed"
    },
    "git": {
      "type": "object",
      "properties": {
        "branch": { "type": "string" },
        "base_branch": { "type": "string" },
        "commits": {
          "type": "array",
          "items": {
            "type": "object",
            "properties": {
              "sha": { "type": "string" },
              "message": { "type": "string" }
            }
          }
        },
        "diff_summary": { "type": "string" }
      }
    },
    "issues": {
      "type": "array",
      "items": { "type": "string" },
      "description": "Problems encountered or unresolved issues"
    },
    "recommendations": {
      "type": "array",
      "items": { "type": "string" },
      "description": "Suggestions for follow-up work"
    },
    "completed_at": { "type": "string", "format": "date-time" },
    "duration_minutes": { "type": "number" },
    "token_usage": {
      "type": "object",
      "properties": {
        "provider": { "type": "string" },
        "input_tokens": { "type": "integer" },
        "output_tokens": { "type": "integer" },
        "estimated_cost": { "type": "string" }
      }
    }
  }
}
